SS Luckenbach,Assessment and Restoration,A02005-OI2,https://www.uscg.mil/Portals/0/npfc/Claims/NRD/A02005-OI2%20NR%20Paid_Redacted.pdf,2010/01/04,BP Exploration & Production Inc. (BP),Approximately 3.19 million barrels of oil,"U.S. Department of the Interior; National Oceanic and Atmospheric Administration; U.S. Environmental Protection Agency; U.S. Department of Agriculture; and the States of Alabama, Florida, Louisiana, Mississippi, and Texas",12,The Deepwater Horizon (DWH) oil spill occurred following the explosion and subsequent sinking of the DWH mobile offshore drilling unit in April 2010. This incident resulted in a massive release of oil into the Gulf of Mexico.,Trustees conducted studies to determine the extent of injuries to natural resources resulting from the spill. These studies involved: (1) identifying the natural resources and ecological services potentially affected by the DWH oil spill; (2) determining the nature and extent of injuries resulting from the spill; and (3) quantifying the degree and spatial extent of such injuries.,"Injuries to a wide range of resources have been observed. Including: submerged aquatic vegetation (SAV), oysters, benthic invertebrate communities, sea turtles, marine mammals, and birds.","$14,163,120.23",
M/V Selendang Ayu,Assessment and Restoration,J05003-OI03,https://www.uscg.mil/Portals/0/NPFC/Claims/NRD/J05003-OI03%20NR%20Paid_redacted.pdf?ver=2017-11-27-092914-907,2017/11/27,BP Exploration & Production Inc.,approximately 4.9 million barrels of oil,"U.S. Department of the Interior,National Oceanic and Atmospheric Administration,U.S. Environmental Protection Agency,U.S. Department of Agriculture,State of Louisiana,State of Mississippi,State of Alabama,State of Florida,State of Texas",9,"The Deepwater Horizon (DWH) oil spill, resulting from the Macondo well blowout on April 20, 2010, released approximately 4.9 million barrels of oil into the Gulf of Mexico.","Trustees conducted extensive studies and data collection to determine and quantify injuries to natural resources caused by the spill. This included assessing impacts on various habitats, species, and ecological services.","Observed impacts on a wide range of species including marine mammals (dolphins), sea turtles, birds, fish, and benthic organisms.",,
Athos I,Assessment and Restoration,P05005-OC1,https://www.uscg.mil/Portals/0/npfc/Claims/NRD/P05005-OC1%20NR_Redacted.pdf,2010/10/05,BP Exploration & Production Inc (BP),approximately 4.9 million barrels of oil,"U.S. Department of Commerce, National Oceanic and Atmospheric Administration,U.S. Department of the Interior,U.S. Environmental Protection Agency,U.S. Department of Agriculture,the States of Alabama,Florida,Louisiana,Mississippi,Texas",9,"On April 20, 2010, the Deepwater Horizon (DWH) mobile drilling unit experienced a blowout and explosion in the Macondo well, resulting in a release of approximately 4.9 million barrels of oil into the Gulf of Mexico","The Trustees conducted extensive studies to determine and quantify injuries to natural resources resulting from the Spill. These studies documented injuries to a wide array of natural resources, including: submerged aquatic vegetation (SAV); oysters; estuarine fish and wildlife; marine mammals; marine fish; sea turtles; birds; and deep sea benthic communities.","Injuries to a wide array of natural resources, including: submerged aquatic vegetation (SAV); oysters; estuarine fish and wildlife; marine mammals; marine fish; sea turtles; birds; and deep sea benthic communities.",,
Tug Powhatan,Assessment and Restoration,J17008-OC02,https://www.uscg.mil/Portals/0/NPFC/Claims/NRD/J17008-OC02.pdf,2023/03/17,Tug Powhatan Oil Spill,Not specified in this document,National Oceanic and Atmospheric Administration (NOAA),1,Tug Powhatan Oil Spill Natural Resource Damages (NRD) Assessment and Restoration Costs,"Pacific herring mortality resulting from direct oil exposure and the public’s lost use of the shellfishery resulting from seafood safety warnings issued by public health officials. NOAA used a combination of response data, site specific resource data, and data from established literature to model the estimated magnitude of injury to both Pacific herring and the public’s use of the shellfishery.",Pacific herring mortality,"$1,328,511.77",
LPV Venezia Mona Island Emergency Restoration,Restoration,UCGPM23039-OC04,https://www.uscg.mil/Portals/0/NPFC/Claims/NRD/UCGPM23039-OC04-LPV%20Venezia%20Mona%20Island%20Emergency%20Restoration.pdf?ver=CHVLsx8MT01YVuLKgUs6zw%3d%3d,2023/10/19,No responsible party (RP) has been identified for this incident,Concerning quantity of oil remaining on the vessel,"National Oceanic and Atmospheric Administration (NOAA),U.S. Fish and Wildlife Service (FWS),PRDNER",3,"Discharge of oil, and substantial threat of discharge, from the LPV Venezia, a vessel, into the Caribbean Sea, a navigable waterway, on or about August 31, 2023.",This is a claim for Emergency Restoration precedes completion of the assessment.,"Threat to nesting critically endangered hawksbill and threatened green sea turtles, their eggs and hatchlings; threatened coral in the nearshore; and other onshore and nearshore species.",,
Pryor Oil,Restoration,E02414-OI2,https://www.uscg.mil/Portals/0/npfc/Claims/NRD/E02414-OI2-%20NR%20Paid_Redacted.pdf,2009/10/28,"Bouchard Transportation Company, Inc. (BTC)","approximately 100 barrels (4,200 gallons)","U.S. Department of the Interior (DOI),U.S. Fish and Wildlife Service (USFWS),National Oceanic and Atmospheric Administration (NOAA)",3,"On April 27, 2003, the tank barge BTC No. 105 (Barge) grounded on Nashawena Island, Massachusetts, releasing approximately 100 barrels (4,200 gallons) of No. 6 fuel oil into Buzzards Bay.","The Trustees assessed injuries to a variety of natural resources, including injury to birds based on field observations of oiled birds, application of an oil exposure model, and incorporation of best available information for oil toxicity. The Trustees also considered injuries to benthic invertebrates due to oiling of sediments, lost recreational uses, and response costs.",Injuries to birds and benthic invertebrates due to oiling of sediments.,undisclosed in the text,
Rogue River,Restoration,G02AAA-OI02,https://www.uscg.mil/Portals/0/NPFC/Claims/NRD/G02AAA-OI02%20Rouge%20Restoration%20Decision%20on%20Reconsideration%20FINAL%20for%20Signature%20REDACTED_Redacted.pdf?ver=2019-11-19-143716-807,2019/09/03,No responsible party (RP) was identified,"339,810 gallons of a 1:1 mixture of diesel fuel oil and waste lubricating oil",Department of the Interior (DOI) and the State of Michigan,2,"Following heavy rain events on April 9 and April 12, 2002 apparent discharges of mixed diesel and lube waste oil were observed in the River Rouge (henceforth called the Rouge River), a tributary to the Detroit River in Detroit, Michigan. There were two separate discharges of the mixture, however the boom installed in the Rouge River following the first discharge largely contained the second discharge. The first discharge resulted in oiling along approximately 17 miles of the Rouge River, the Detroit River, and western Lake Erie.","The Trustees assessed injuries to birds, muskrats, reptiles and amphibians, fish, and marsh habitat. The Trustees determined that natural recovery was sufficient to restore resources to baseline levels, and chose to limit their Claim to compensatory damages for interim losses. The interim loss was characterized in terms of direct mortality and foregone productivity of the various resource categories. The Trustees used the Spill Impact Model Analysis Package (SIMAP) to model the direct mortality and foregone productions for each resource category and convert those losses to the amount of food (marsh biomass) required to replace the lost production.","Impact on birds, muskrats, reptiles and amphibians, fish, and marsh habitat; 110 birds observed dead, oiled and rehabilitated, or observed oiled but not captured; one dead and two rehabilitated turtles observed.",0,
T/V Margara,Restoration,M06017-OC01,https://www.uscg.mil/Portals/0/NPFC/Claims/NRD/M06017-OC01.pdf?ver=2019-09-09-113202-653,2019/02/08,"Ernst Jacob (GMbh & Co. KG) (ErnstJacob), operator of the T/V Margara. Shipowners Insurance & Guaranty Company, Ltd. (SIGCo) was subsequently identified as the RP’s guarantor.",None,National Oceanic and Atmospheric Administration (NOAA) and the Puerto Rico Department of Natural and Environmental Resources (PRDNER),2,"On April 27, 2006, the T/V Margara grounded three miles off the coast of Tallaboa, Puerto Rico while awaiting a pilot. The vessel, carrying approximately 315,693 barrels of No. 6 fuel oil, grounded in an area of dense coral reefs.","Following the incident, the Trustees conducted surveys using divers and GPS technology to map the area of impact. In November 2006 they pursued a more thorough survey approach that utilized boat-mounted SONAR. Survey results were later updated in 2007 by post-Hurricane Dean observations from a joint RP/Trustee diving trip. An area of 1,662 meters² of rubble where primary restoration was needed was quantified. Monitoring efforts indicated that the survival of coral recruits in rubble areas was drastically lower than in reference sites and that coral recovery is not occurring in rubble areas. From 2008 to 2012 the Trustees monitored the recruitment and survival of corals to determine whether coral recovery was occurring in the response-caused rubble areas.","The removal activities resulted in dislodged, broken and buried coral resources, along with fractured reef foundation that caused large amounts of coral rubble. The Trustees estimated that approximately 7,541 meters² of impacted coral reef were associated with the incident, including the loss of 54,623 hard corals and 112,151 soft corals for a total of 166,774 corals lost.","$4,403,590.98 (settlement offer) + $794,183.46 (potential contingency)",
M/V Jireh,Restoration,M12037-OC02,https://www.uscg.mil/Portals/0/npfc/Claims/NRD/M12037-OC02%20NR%20Paid_Redacted.pdf,2012/12/18,No responsible party has been identified for this incident,The vessel presented a substantial threat of oil discharge,National Oceanic Atmospheric Administration (NOAA) and the Puerto Rico Department of Natural and Environmental Resources (PRDNER),2,"On June 21, 2012, the coastal freighter M/V Jireh ran aground on the south shore of Mona Island, located 40 miles west of the main island of Puerto Rico. The vessel grounded on a rocky shoreline within a designated natural reserve with known coral reef habitat. During response efforts, the USCG used anchors and tow lines to stabilize the M/V Jireh and secure platforms for the salvage operation. These cables and anchors dislodged, damaged, and broke an estimated 950 corals, including 12 colonies of Elkhorn coral (a federally threatened species).","The cables and anchors dislodged, damaged, and broke an estimated 950 corals, including 12 colonies of Elkhorn coral (a federally threatened species). The trustees temporarily righted and stabilized these corals during the response activities to destroy the vessel.","Damaged and broke an estimated 950 corals, including 12 colonies of Elkhorn coral (a federally threatened species).","$201,587.50",
New Carissa,Restoration,S99018-OI1,https://www.uscg.mil/Portals/0/npfc/Claims/NRD/S99018-OI1%20NR_Redacted.pdf,2007/01/24,"BP Exploration and Production, Inc. (BP)",approximately 3.19 million barrels of oil,"The Trustees are comprised of representatives from the federal government (National Oceanic and Atmospheric Administration (NOAA), U.S. Department of the Interior (DOI), U.S. Environmental Protection Agency (EPA), U.S. Department of Agriculture (USDA)) and the Gulf States (Florida, Alabama, Mississippi, Louisiana, and Texas).",Several - representatives from multiple agencies and states,The Deepwater Horizon (DWH) oil spill was the result of the explosion and subsequent sinking of the mobile offshore drilling unit DWH in April 2010.,"The Trustees conducted extensive studies to determine the type, degree, and spatial and temporal extent of injuries resulting from the DWH oil spill.","These studies documented injuries to a wide variety of natural resources, including: coastal wetlands; submerged aquatic vegetation; oysters; benthic communities; marine mammals; sea turtles; birds; and fish and other aquatic life.",Not specified in provided text.,
New Carissa,Restoration,S99018-OI2,https://www.uscg.mil/Portals/0/npfc/Claims/NRD/S99018-OI2%20Recon%20NR_Redacted.pdf,2009/08/26,M/V Cape Flattery,"Approximately 21,000 gallons of intermediate fuel oil (IFO 180)","National Oceanic and Atmospheric Administration (NOAA), U.S. Department of the Interior (DOI), represented by the U.S. Fish and Wildlife Service (USFWS), and the Washington Department of Ecology (Ecology)",4,"On March 10, 2007, the M/V Cape Flattery released approximately 21,000 gallons of intermediate fuel oil (IFO 180) into the waters of Puget Sound near Port Angeles, Washington, after the vessel struck a submerged object.","Trustees conducted studies and assessments to determine the nature and extent of injuries to natural resources. These assessments included evaluations of injury to seabirds, marine mammals, and intertidal habitats due to oiling.","The oil spill resulted in injury to seabirds (primarily surf scoters), marine mammals (harbor seals), and intertidal habitats.",Unknown,
F/V Deep Sea,Restoration,S12020-WA02,https://www.uscg.mil/Portals/0/NPFC/Claims/NRD/S12020-WA02%20NR%20Paid.pdf?ver=2018-06-07-095708-743,2018/04/29,"Owner of the F/V Deep Sea, (b) (6), (b) (4)","Approximately 5,500 gallons of diesel, hydraulic, and lube oils",Washington Department of Fish and Wildlife (WDFW),"Not explicitly stated, but WDFW is acting as the trustee.","On May 12, 2012, the former commercial fishing vessel, Deep Sea, anchored in Penn Cove, Whidbey Island, Washington, burned and sank, resulting in the discharge of approximately 5,500 gallons of diesel, hydraulic, and lube oils into Penn Cove","The Washington State DOH closed the recreational shellfishery in Penn Cove on May 14, 2012 in response to visible oil sheen resulting from the discharge from the F/V Deep Sea. Based on the results of the DOH enforced beach closures and the status of beaches for shellfish harvest just prior to and following reopening, it was determined that San de Fuca, West Penn Cove, and Long Point were each closed for 22 days due to potential oil contamination while Madrona beach was closed for 38 days. The southern part of West Penn Cove beach also remained closed until June 22, 2012 (38 days). Harvester data was modeled based on beach user data from 2010 and 2011, resulting in a total of 1,995.55 user days.",Closure of recreational and commercial shellfisheries in Penn Cove due to the presence of visible oil sheens in the area and potential contamination.,"$97,722 (Amount offered by NPFC)",
