Deepwater Horizon,Assessment,N10036-OI23,https://www.uscg.mil/Portals/0/npfc/Claims/NRD/N10036-OI23%20NR%20Recon%20Paid_Redacted.pdf,2014/12/17,BP,"Oil discharge on or about April 20, 2010, from a facility located on an area of land leased by BP (the Deepwater Horizon incident).",U.S. Department of the Interior (DOI),Not Specified,Deepwater Horizon oil spill,Assessments to evaluate damages to natural resources resulting from the Deepwater Horizon oil spill in order to develop a damage assessment restoration plan (DARP).,"Damages to natural resources (i.e., birds, sea turtles, sturgeon, etc.).","$1,967,560",
Deepwater Horizon,Assessment,N10036-OI24,https://www.uscg.mil/Portals/0/npfc/Claims/NRD/N10036-OI24%20NR%20Paid_Redacted.pdf,2014/07/03,"BP Exploration & Production, Inc. (BP)",210 million gallons,"Department of the Interior (DOI),Department of Commerce, represented by National Oceanic and Atmospheric Administration,Louisiana,Mississippi,Alabama,Florida,Texas",7,"On April 20, 2010, the Deepwater Horizon mobile offshore drilling unit exploded and sank, discharging an estimated 210 million gallons of oil into the Gulf of Mexico until the well was capped on July 15, 2010. Responders to the discharge dispensed approximately 1.84 million gallons of dispersants to keep, or delay, the oil from reaching sensitive shorelines.","DOI plans to collect data on the number of birds oiled by factors other than the Deepwater Horizon oil spill such as natural seeps, marine vessels that release oil through bilge discharges and engine exhaust, and releases from oil and gas exploration/production activities (background oiling rate). The study area extends from Galveston Bay Inlet, Texas, to Apalachicola, Florida. This background oiling rate will then be used by the trustees to distinguish the number of birds oiled due to the Deepwater Horizon oil spill from birds oiled by other factors","Over 950 miles of oiled shoreline habitat, 400 oiled sea turtles, 1,500 oiled birds, and identified numerous other natural resources at risk to include fish, marine mammals, oysters, and associated habitats.","$7,338,962",
Deepwater Horizon,Assessment,N10036-OI31,https://www.uscg.mil/Portals/0/npfc/Claims/NRD/N10036-OI31%20NR%20Paid_Redacted.pdf,2015/07/31,"BP Exploration & Production, Inc. (BP)",210 million gallons,"Department of the Interior (DOI),Department of Commerce represented by National Oceanic and Atmospheric Administration (NOAA),Louisiana,Mississippi,Alabama,Florida,Texas",7,"On April 20, 2010, the Deepwater Horizon mobile offshore drilling unit exploded and sank, discharging an estimated 210 million gallons of oil into the Gulf of Mexico until the well was capped on July 15, 2010.","DOI leads the trustee efforts to assess injuries and plan restoration for birds, nesting sea turtles, federal lands, threatened and endangered species, and beaches and barrier islands. DOI also provides technical expertise for other NOAA-led assessment activities. In 2015, DOI will work to develop a Damage Assessment and Restoration Plan (DARP) that the public will be given an opportunity to review. Specifically, DOI will complete injury quantification activities; complete study summaries and technical reports; scale injury to restoration projects; and coordinate with other trustees, contract scientist, data managers, and the public. DOI states, 'staff will be providing input and oversight into the development of the DARP and will continue until the draft plan is ready for public review and comment.'","The trustees observed over 950 miles of oiled shoreline habitat, 400 oiled sea turtles, 1,500 oiled birds, and identified numerous other natural resources at risk to include fish, marine mammals, oysters, and associated habitats.","16,904,235",
Deepwater Horizon,Assessment,N10036-OC14,https://www.uscg.mil/Portals/0/npfc/Claims/NRD/N10036-OC14%20NR%20Paid_Redacted.pdf,2013/11/06,"BP Exploration & Production, Inc. (BP)",estimated 210 million gallons,"NOAA, the Department of the Interior and five Gulf Coast states (Louisiana, Mississippi, Alabama, Florida, and Texas)",7,"On April 20, 2010, the Deepwater Horizon mobile offshore drilling unit exploded and sank, discharging an estimated 210 million gallons of oil into the Gulf of Mexico until the well was capped on July 15, 2010.","The trustees identified 13 resource/habitat injury categories, one of which is lost human use of natural resources injured by the spill and/or associated with the closures. Potential direct human use losses include disruptions in recreational boating, fishing, beach activities, and bird watching, while potential indirect, or non use, losses represent the value that people place on the injured natural resource(s), even if they will never use it.","Over 950 miles of oiled shoreline habitat, 400 oiled sea turtles, and over 1,500 oiled birds were observed. 39,885 square miles of Gulf of Mexico federal waters remained closed to fishing.","$3,839,965.85",
Deepwater Horizon,Assessment,N10036-OC15,https://www.uscg.mil/Portals/0/npfc/Claims/NRD/N10036-OC15%20NR%20Paid_Redacted.pdf,2013/01/16,"BP Exploration & Production, Inc. (BP)",134.4 to 210.0 million gallons,"NOAA,Department of the Interior,Louisiana,Mississippi,Alabama,Florida,Texas",7,"On April 20, 2010, the Deepwater Horizon mobile offshore drilling unit exploded and sank, discharging an estimated 134.4 to 210.0 million gallons of oil into the Gulf of Mexico, until the well was capped on July 15, 2012.","The trustees identified 13 resource/habitat injury categories, one of which is lost human use. For the human use component, the interconnected resource/habitat categories are related to, and supportive of, direct lost human use and passive use. The trustees are using several sources of data to establish baseline. NOAA will draft, test, and implement a survey to determine the monetary value of direct and passive use losses using stated preference methods.","Over 950 miles of oiled shoreline habitat, 400 oiled sea turtles, and over 1,500 oiled birds","$20,074,000",
Deepwater Horizon,Assessment,N10036-OC18,https://www.uscg.mil/Portals/0/npfc/Claims/NRD/N10036-OC18%20NR%20First%20Partial%20Paid_Redacted.pdf,2014/02/03,"BP Exploration & Production, Inc. (BP)",210 million gallons,"National Oceanic Atmospheric Administration (NOAA), the Department of the Interior, and five Gulf Coast states (Louisiana, Mississippi, Alabama, Florida, and Texas)",7,"On April 20, 2010, the Deepwater Horizon mobile offshore drilling unit exploded and sank, discharging an estimated 210 million gallons of oil into the Gulf of Mexico until the well was capped on July 15, 2010.","The trustees initiated an assessment of natural resource damages resulting from the discharges and response to discharges of oil. The trustees observed over 950 miles of oiled shoreline habitat, 400 oiled sea turtles, 1,500 oiled birds, and identified numerous other natural resources at risk to include fish, marine mammals, oysters, and associated habitats. The trustees have continued to work together to develop and implement assessment plans to determine the nature and extent of these losses.","Oiled shoreline habitat, oiled sea turtles, oiled birds, fish, marine mammals, oysters, Sargassum, coastal marshes and mangroves.","$46,390,569",
Deepwater Horizon,Assessment,N10036-OC18,https://www.uscg.mil/Portals/0/npfc/Claims/NRD/N10036-OC18%20NR%20Second%20Partial%20Paid_Redacted.pdf,2014/02/19,"BP Exploration & Production, Inc. (BP)",210 million gallons,"Department of Commerce, National Oceanic Atmospheric Administration (NOAA),Department of the Interior, Fish and Wildlife Service (FWS),Louisiana,Mississippi,Alabama,Florida,Texas",7,"The Deepwater Horizon mobile offshore drilling unit exploded and sank, discharging an estimated 210 million gallons of oil into the Gulf of Mexico.","The trustees initiated an assessment of natural resource damages resulting from the discharges and response to discharges of oil.  They observed oiled shoreline habitat, oiled sea turtles, and oiled birds and identified numerous other natural resources at risk to include fish, marine mammals, oysters, and associated habitats. The trustees have continued to work together to develop and implement assessment plans to determine the nature and extent of these losses.","Observed over 950 miles of oiled shoreline habitat, 400 oiled sea turtles, and over 1,500 oiled birds; and identified numerous other natural resources at risk to include fish, marine mammals, oysters, and associated habitats. Found endocrine, respiratory, and hepatic disease in dolphins consistent with adverse health effects as reported from experimental oil exposure studies.  These health conditions were observed in Barataria Bay, LA, an area that experienced heavy oiling, but were not observed in dolphins from Sarasota Bay, FL, an area that was not oiled. Marine mammals may have been injured by oil inhalation during the spill.  ","12,585,574",
Deepwater Horizon,Assessment,N10036-OC18,https://www.uscg.mil/Portals/0/npfc/Claims/NRD/N10036-OC18%20NR%20Third%20Partial%20Paid_Redacted.pdf,2014/03/07,"BP Exploration & Production, Inc. (BP)",210 million gallons,"National Oceanic and Atmospheric Administration (NOAA),Department of the Interior, Fish and Wildlife Service (FWS),Louisiana,Mississippi,Alabama,Florida,Texas",7,"On April 20, 2010, the Deepwater Horizon mobile offshore drilling unit exploded and sank, discharging an estimated 210 million gallons of oil into the Gulf of Mexico until the well was capped on July 15, 2010. Responders to the discharge dispensed approximately 1.84 million gallons of dispersants to keep, or delay, the oil from reaching sensitive shorelines.","The trustees have continued to work together to develop and implement assessment plans to determine the nature and extent of these losses. For 2014, NOAA claims $14,564,968 under four separate activities (A1-A4, below) for additional surveys and analyses of samples from the three habitat types and associated fauna. In 2014, NOAA plans to further analyze 2011 data and estimate total injury.","By the August-September 2010 period, the trustees observed over 950 miles of oiled shoreline habitat, 400 oiled sea turtles, and over 1,500 oiled birds; and identified numerous other natural resources at risk to include fish, marine mammals, oysters, and associated habitats. Chronic, sublethal effects that are consistent with oil exposure are still being detected in live and dead dolphins in 2013 within the footprint of the spill. Initial findings show a significantly higher number of observed marine mammal carcasses on Gulf beaches from April 2010 through May 2013, with histopathology evaluations of 2013 strandings from Mississippi and Louisiana indicating adrenal abnormalities, bronchopneumonia, Brucella sp. infections, chronic lung disease and other long-term health issues associated with oil exposure.","$23,305,087",
Deepwater Horizon,Assessment,N10036-OC18,https://www.uscg.mil/Portals/0/npfc/Claims/NRD/N10036-OC18%20NR%20Fourth%20Partial%20Paid_Redacted.pdf,2014/04/17,"BP Exploration & Production, Inc. (BP)",210 million gallons,"National Oceanic and Atmospheric Administration (NOAA),Department of the Interior, Fish and Wildlife Service (FWS),Louisiana,Mississippi,Alabama,Florida,Texas",7,"On April 20, 2010, the Deepwater Horizon mobile offshore drilling unit exploded and sank, discharging an estimated 210 million gallons of oil into the Gulf of Mexico until the well was capped on July 15, 2010.","NOAA is assessing potential injuries to oysters by measuring abundance and biomass, evaluating reproductive condition, and estimating larval recruitment in nearshore and subtidal waters affected by Deepwater Horizon oil.  NOAA has also undertaken laboratory assessment of oil toxicity, which has shown that very low concentrations of oil kill oyster larvae, prevent normal fertilization from occurring, and produce developmental abnormalities in embryos and free-swimming larvae that ultimately lead to death. Tens of thousands of samples were collected during assessment activities in 2010 and 2011 of oil, sediments, tissues, and water; and spanned across all resource areas (i.e., offshore, nearshore, and shoreline). In 2014, NOAA plans to analyze approximately 2,850 offshore sediment and biota samples, 700 shoreline sediment samples, 620 archived sargassum samples, 1,877 nearshore sediment and biota samples, and 1,450 forensic oil and contaminant samples (7,497 total samples).","Over 950 miles of oiled shoreline habitat, 400 oiled sea turtles, and over 1,500 oiled birds were observed. Reduced adult and juvenile oyster abundance and spat recruitment across the full spatial footprint of the Deepwater Horizon oiling area. Very low concentrations of oil kill oyster larvae, prevent normal fertilization from occurring, and produce developmental abnormalities in embryos and free-swimming larvae that ultimately lead to death.","27,058,569",
Deepwater Horizon,Assessment,N10036-OC18,https://www.uscg.mil/Portals/0/npfc/Claims/NRD/N10036-OC18%20NR%20Fifth%20Partial%20Paid_Redacted.pdf,2014/04/24,"BP Exploration & Production, Inc. (BP)",210 million gallons,"National Oceanic and Atmospheric Administration (NOAA),Department of the Interior, Fish and Wildlife Service (FWS),Louisiana,Mississippi,Alabama,Florida,Texas",7,"On April 20, 2010, the Deepwater Horizon mobile offshore drilling unit exploded and sank, discharging an estimated 210 million gallons of oil into the Gulf of Mexico until the well was capped on July 15, 2010.","The trustees initiated an assessment of natural resource damages resulting from the discharges and response to discharges of oil. They observed over 950 miles of oiled shoreline habitat, 400 oiled sea turtles, and over 1,500 oiled birds. Numerous other natural resources at risk including fish, marine mammals, oysters, and associated habitats were identified. The trustees continue to work together to develop and implement assessment plans to determine the nature and extent of these losses.","Oiled shoreline habitat, oiled sea turtles, oiled birds, fish, marine mammals, oysters, and associated habitats were identified.","$14,620,918",
Deepwater Horizon,Assessment,N10036-OC27,https://www.uscg.mil/Portals/0/npfc/Claims/NRD/N10036-OC27%20NRD%20Paid_Redacted.pdf,2015/04/03,"BP Exploration & Production, Inc. (BP)",3.19 million barrels,"Department of Commerce, National Oceanic and Atmospheric Administration (NOAA),Department of the Interior, Fish and Wildlife Service (FWS),Environmental Protection Agency (EPA),Department of Agriculture (USDA),Louisiana,Mississippi,Alabama,Florida,Texas",9,"On April 20, 2010, the Deepwater Horizon mobile offshore drilling unit exploded and sank, discharging an estimated 3.19 million barrels of oil into the Gulf of Mexico (GOM) until the well was capped on July 15, 2010.","The trustees initiated an assessment of natural resource damages resulting from the discharges and response to discharges of oil. By September 2010, the trustees observed over 950 miles of oiled shoreline habitat, 400 oiled sea turtles, and 1,500 oiled birds. Numerous other natural resources at risk, including fish, marine mammals, oysters, and aquatic habitats, were identified. The trustees continue to work together to develop and implement plans to assess the nature and extent of these losses and appropriate restoration alternatives.","Oiled shoreline habitat, oiled sea turtles, oiled birds, injuries to fish, marine mammals, oysters, and aquatic habitats.","$28,994,300",
Deepwater Horizon,Assessment,N10036-OC30,https://www.uscg.mil/Portals/0/npfc/Claims/NRD/N10036-OC30%20NRD%20Paid_Redacted.pdf,2015/07/23,"BP Exploration & Production, Inc. (BP)",3.19 million barrels,"Department of Commerce, National Oceanic and Atmospheric Administration (NOAA),Department of the Interior, Fish and Wildlife Service (FWS),Environmental Protection Agency (EPA),Department of Agriculture (USDA),Louisiana,Mississippi,Alabama,Florida,Texas",9,"On April 20, 2010, the Deepwater Horizon mobile offshore drilling unit exploded and sank, discharging an estimated 3.19 million barrels of oil into the Gulf of Mexico (GOM) until the well was capped on July 15, 2010. Responders to the discharge applied approximately 1.84 million gallons of dispersants to keep, or delay, the oil from reaching sensitive shorelines.",The trustees initiated an assessment of natural resource damages resulting from the discharges and response to discharges of oil. The trustees continue to work together to develop and implement plans to assess the nature and extent of these losses and appropriate restoration alternatives.,"By September 2010, the trustees observed over 950 miles of oiled shoreline habitat, 400 oiled sea turtles, and 1,500 oiled birds. Numerous other natural resources at risk, including fish, marine mammals, oysters, and aquatic habitats, were identified.","$72,541,800",
Texas City Y Oil Spill Assessment,Assessment,N14026-OC01,https://www.uscg.mil/Portals/0/npfc/Claims/NRD/N14026-OC01_Redacted.pdf,2015/12/08,BP Exploration & Production Inc. (BP),Approximately 3.19 million barrels of oil,"U.S. Department of the Interior,National Oceanic and Atmospheric Administration,U.S. Environmental Protection Agency,U.S. Department of Agriculture,State of Louisiana,State of Mississippi,State of Alabama,State of Florida,State of Texas",9,"The Deepwater Horizon (DWH) MC252 oil spill, which began on April 20, 2010, with an explosion on the DWH mobile offshore drilling unit and continued until the well was capped on July 15, 2010.","Injury determination involved identifying the pathways of exposure, identifying the resources potentially exposed, and determining whether exposure resulted in an adverse effect. Quantification of injury involved determining the spatial and temporal extent of the injury and scaling the injury to a common metric for restoration planning.","Observed injuries included mortality and sublethal effects on various species of birds, sea turtles, marine mammals, fish, oysters, benthic invertebrates, and plankton.",,
Oregon/Washington Coast Mystery Spill,Assessment,S99028-OI01,https://www.uscg.mil/Portals/0/npfc/Claims/NRD/S99028-OI01%20NR%20Paid_Redacted.pdf,2016/03/24,BP Exploration & Production Inc. (BP),Approximately 4.9 million barrels of oil,"U.S. Department of the Interior,National Oceanic and Atmospheric Administration,U.S. Environmental Protection Agency,U.S. Department of Agriculture,The Gulf States (Louisiana, Mississippi, Alabama, Florida, and Texas)",6,"The Deepwater Horizon (DWH) MC252 oil spill, which began on April 20, 2010, following an explosion on the DWH mobile drilling unit and continued for 87 days.","Trustees conducted extensive studies and sampling to determine and quantify injuries to a wide variety of natural resources, including marine mammals, sea turtles, birds, fish, oysters, submerged aquatic vegetation, wetlands, and beaches.",Observed injuries included: mortality and sublethal effects on marine mammals and sea turtles; bird mortality; fish mortality and reduced growth; oyster mortality; loss of submerged aquatic vegetation and wetlands; and tarring of beaches.,,
Oregon/Washington Coast Mystery Spill,Assessment,S99028-OI01,https://www.uscg.mil/Portals/0/npfc/Claims/NRD/S99028-OI01%20Recon%20NR%20Paid.pdf,2016/07/14,"BP Exploration & Production, Inc. (BP)",Approximately 4.9 million barrels of oil,"U.S. Department of the Interior (DOI), National Oceanic and Atmospheric Administration (NOAA), U.S. Environmental Protection Agency (EPA), U.S. Department of Agriculture (USDA), and the Gulf States","Variable, composed of members from DOI, NOAA, EPA, USDA, and the five Gulf States (Florida, Alabama, Mississippi, Louisiana, and Texas)","The Deepwater Horizon (DWH) oil spill, initiated by an explosion on the Deepwater Horizon mobile drilling unit on April 20, 2010, resulting in a release of oil into the Gulf of Mexico.",Injury determination and quantification involves assessing the harm caused by the oil spill to natural resources and the services they provide. This includes using scientific studies and models to estimate the extent of injury and lost resource services.,"The oil spill caused a wide range of biological effects, including harm to marine mammals, birds, sea turtles, fish, shellfish, and deep-sea benthic communities. These effects ranged from direct mortality to sublethal impacts on growth, reproduction, and immune function.",,
"Texas Trustee Claim, 14 Different Incidents",Assessment,Texas-Galveston Bay,https://www.uscg.mil/Portals/0/npfc/Claims/NRD/Texas-Galveston%20Bay_Redacted.pdf,2008/08/18,"BP Exploration & Production, Inc. (BP)",Approximately 4.9 million barrels of oil,"U.S. Department of the Interior,National Oceanic and Atmospheric Administration,U.S. Environmental Protection Agency,U.S. Department of Agriculture,The State of Louisiana,The State of Mississippi,The State of Alabama,The State of Florida,The State of Texas",9,The Deepwater Horizon (DWH) oil spill was the result of the explosion and subsequent sinking of the DWH mobile offshore drilling unit in April 2010.,"The Trustees conducted extensive field and laboratory studies to determine the nature and extent of injuries to natural resources that resulted from the DWH oil spill. These studies examined a wide range of resources, including wetlands, coastal beaches, offshore waters and nearshore waters, submerged aquatic vegetation, oysters, benthic communities, marine mammals, sea turtles, and birds.",Observed injuries include: Mortality; Reduced Growth; Reproductive Impairment; Habitat Loss and Degradation,Undetermined from this text,
Tug Powhatan,Assessment and Restoration,J17008-OC02,https://www.uscg.mil/Portals/0/NPFC/Claims/NRD/Powhatan_Determination_marked_redactions_Redacted.pdf?ver=RLVDti4cReQz_breCPRUaA%3d%3d,2022/11/07,Samson Tug & Barge,"Unknown volume of diesel fuel, gasoline, fuel residues, and lubricating oils","National Oceanic and Atmospheric Administration (NOAA),U.S. Fish and Wildlife Service,Alaska Department of Fish and Game,Alaska Department of Law,Alaska Department of Environmental Conservation",5,"On April 19, 2017, an out of service tugboat, the Powhatan, owned by Samson Tug & Barge sank from its dock in Starrigavan Bay near Sitka, Alaska. After sinking, the tug slid downslope and came to rest approximately 330 meters offshore in approximately 60 meters of water. The Powhatan contained an unknown volume of diesel fuel, gasoline, fuel residues, and lubricating oils. Shortly after sinking visible oil sheens were observed in Starrigavan Bay and Sitka Sound. Subsequent diver inspections confirmed an ongoing discharge from the vessel and identified numerous places in the vessel where oil escaped. The two main fuel vents were capped on April 25, 2017, and the source was controlled when the Powhatan was removed from the water on June 12, 2017.",NOAA determined that the natural resource injury quantification for the incident was best represented by two types of losses: (1) direct loss (death) of Pacific herring eggs and larvae in Sitka Sound; and (2) the lost use of the public shellfishery at Starrigavan Beach. NOAA’s assessment procedures to calculate these losses and the associated damages relied heavily on data modeling.,"Approximately 25.4 billion Pacific herring egg-equivalents were killed due to exposure from oil discharged from the tug Powhatan. Lost recreational use of the shellfishery, NOAA estimated that 833 recreational shellfishing trips, for a total value of $36,914 were lost at Starrigavan Beach due to the oil spill.","$0.00 (The NPFC previously determined that the RP and their insurer were entitled to the tug Powhatan’s statutory limitation of liability of $989,800 and had no further liability for removal costs and damages.)",
T/B DBL152,Assessment and Restoration,N06008,https://www.uscg.mil/Portals/0/NPFC/Claims/NRD/N06008-OC01_DBL_152_Recon_Determination_for_posting.pdf?ver=5MdEL2O4kI9Ptk8RWgpwGA%3d%3d&timestamp=1626898232241,2021/02/08,K-Sea Operating Partnership LP,"45,846 barrels",National Oceanic and Atmospheric Administration (NOAA),1,"On November 11, 2005, the double-hulled Tank Barge DBL 152 struck the submerged remains of a pipeline service platform approximately 32 miles south of Calcasieu Pass, Louisiana. The cargo and ballast tanks of the barge, which carried approximately 119,000 barrels of #6 fuel oil, were punctured by the allision, and the barge began taking on water and discharging oil.","NOAA conducted a natural resource damage assessment (NRDA) to determine the nature and extent of injuries resulting from the spill. Through their assessment efforts, NOAA estimated that the equivalent of 450 acres of offshore benthic habitat suffered 100% service loss for two years before onset of recovery as a result of oil discharged from the incident.  They employed the Habitat Equivalency Analysis (HEA), to quantify the injury and scale of restoration needed to compensate for the injury.","Injury to benthic invertebrates and potential injuries to demersal fishes, pelagic fishes, and marine mammals resulted from the released oil from smothering and coating of benthic resources and ingestion by animals that feed on benthic resources and demersal fishes in the affected area.","The NPFC determined that the RP and their guarantor were entitled to DBL 152’s statutory limitation of liability of $11,689,200 and had no further liability for removal costs and damages. NOAA received $4,839,407.50 from the OSLTF (Oil Spill Liability Trust Fund)",
